ISBN	Title	Subtitle	Author	Editorial	Synopsis	Subject	SubjectCode
9788488342836	Pomelo es feliz		Ramona Bădescu	Kókinos	Pomelo es un elefantito rosa con una trompa larguísima que vive debajo de un diente de león y contempla el mundo del huerto con ternura y asombro filosófico. Entre sueños extraños, encuentros con hortalizas parlantes y celebraciones fuera de temporada, descubre que la felicidad se esconde en los pequeños detalles cotidianos. Primer título de una serie adorable y poética ilustrada por Benjamin Chaud que ha conquistado al público infantil más sofisticado.	3 - 5 AÑOS	1002
9788492608348	Pequeño azul y pequeño amarillo		Leo Lionni	Kalandraka	Pequeño Azul y Pequeño Amarillo son dos amigos inseparables que un día se abrazan tan fuerte que se transforman en un solo color verde, irreconocibles incluso para sus propias familias. La pequeña fábula explica con manchas de papel rasgado la alegría de la amistad y el misterio de las mezclas. Publicado originalmente en 1959, es considerado uno de los primeros álbumes ilustrados modernos y una obra maestra de Leo Lionni.	3 - 5 AÑOS	1002
9788416578085	La gran fábrica de las palabras		Agnès de Lestrade	Tramuntana	En un país silencioso donde para hablar hay que comprar y tragar las palabras, el pequeño Bruno solo tiene tres palabras en el bolsillo para declararle su amor a la bella Cibelle. Cuando llega el momento descubre que a veces los sentimientos más profundos no necesitan palabras valiosas sino sinceras. Un álbum poético y tierno ilustrado por Valeria Docampo que se ha convertido en un favorito para hablar del valor de las palabras.	3 - 5 AÑOS	1002
9788448825959	Dinosaurios	Un viaje a la prehistoria en tres dimensiones	Varios autores	Beascoa	Un recorrido tridimensional por el mundo de los dinosaurios en el que gigantescos herbívoros, feroces carnívoros y enormes reptiles marinos cobran vida al abrir cada página gracias a sus desplegables, solapas y lengüetas interactivas. Los lectores viajan a la era mesozoica descubriendo datos fascinantes sobre la vida prehistórica. Un libro pop-up de gran formato ideal para despertar la curiosidad científica de los más pequeños.	LIBROS POP UP	1012
9788420482880	Charlie y la fábrica de chocolate		Roald Dahl	Alfaguara	Charlie Bucket es un niño pobre y bondadoso que consigue uno de los cinco billetes dorados escondidos en las chocolatinas de Willy Wonka y obtiene así el pase para visitar la misteriosa fábrica del excéntrico chocolatero. Junto a otros cuatro niños insoportables, Charlie recorre habitaciones llenas de ríos de chocolate, Oompa Loompas y inventos imposibles mientras los demás van siendo eliminados por sus propios defectos. Un clásico universal del humor infantil ilustrado por Quentin Blake y publicado en la colección Alfaguara Clásicos.	9 - 12 AÑOS	1004
9788420482873	Matilda		Roald Dahl	Alfaguara	Matilda Wormwood es una niña prodigio de cinco años, apasionada por los libros, a la que sus padres desprecian y maltratan por considerarla rara. En la escuela debe enfrentarse a la despiadada señorita Trunchbull, pero encontrará una aliada en la dulce señorita Honey y descubrirá que posee unos poderes mentales extraordinarios. Una novela inolvidable sobre el poder de los libros y la justicia infantil, ilustrada por Quentin Blake y publicada en la colección Alfaguara Clásicos.	9 - 12 AÑOS	1004
9788420464473	El pequeño Nicolás		René Goscinny	Alfaguara	Nicolás es un niño francés que narra con una ingenuidad desopilante sus aventuras cotidianas con una pandilla de amigos inolvidables: Alcestes el comilón, Godofredo el presumido, Clotario el último de la clase o Eudes el pegón. Entre sus travesuras en el colegio, las comidas familiares y los partidos de fútbol, descubrimos con humor tierno el universo de la infancia. Ilustrado por Jean-Jacques Sempé, este clásico de Goscinny ha cautivado a varias generaciones de lectores jóvenes.	6 - 8 AÑOS	1003
9788432214233	Manolito Gafotas		Elvira Lindo	Seix Barral	Manolito, un niño con gafas del barrio madrileño de Carabanchel Alto, narra en primera persona sus aventuras con su pandilla, su hermano el Imbécil, su abuelo Nicolás y su madre. Con una mezcla irresistible de coloquialismos, exageraciones y ternura, Manolito retrata la vida de una familia de clase trabajadora española con humor y crítica social. Primer título de la serie creada originalmente para la radio por Elvira Lindo, ganadora del Premio Nacional de Literatura Infantil y Juvenil.	6 - 8 AÑOS	1003
9788420482767	Momo		Michael Ende	Alfaguara	Momo es una niña andrajosa que vive en las ruinas de un anfiteatro a las afueras de una gran ciudad y posee el don extraordinario de saber escuchar a los demás. Cuando unos siniestros hombres grises empiezan a robarle el tiempo a la gente, Momo, junto con la tortuga Casiopea y el maestro Hora, emprenderá una aventura épica para salvar a la humanidad. Una novela fábula imprescindible sobre el valor del tiempo y la amistad, considerada uno de los grandes clásicos de la literatura infantil contemporánea.	9 - 12 AÑOS	1004
9788420471549	La historia interminable		Michael Ende	Alfaguara	Bastián Baltasar Bux, un niño solitario y acomplejado, roba un libro misterioso en una pequeña librería y se descubre atrapado en el mundo de Fantasia, un reino mágico que está siendo devorado por la Nada. Junto al joven guerrero Atreyu y la dragona Fújur, Bastián deberá encontrar a la Emperatriz Infantil y salvar ese universo con su propia imaginación. Una de las grandes novelas fantásticas del siglo XX, traducida por Miguel Sáenz y ganadora del Premio Nacional alemán de Literatura Infantil.	9 - 12 AÑOS	1004
9788415594024	Wonder. La lección de August		R. J. Palacio	Nube de Tinta	August Pullman es un niño de diez años con una severa deformidad facial que nunca ha ido a la escuela porque ha pasado casi toda su vida entrando y saliendo de quirófanos. Cuando sus padres deciden por fin matricularlo en quinto curso, August deberá enfrentarse a las miradas, las burlas y los verdaderos amigos de sus compañeros. Narrada desde múltiples voces, la novela de R. J. Palacio se convirtió en un fenómeno mundial sobre la empatía, la bondad y la aceptación de las diferencias.	9 - 12 AÑOS	1004
9788498672220	Diario de Greg 1	Un pringao total	Jeff Kinney	RBA Molino	Greg Heffley acaba de empezar la secundaria y decide llevar un diario ilustrado en el que relata con dibujos divertidísimos su lucha diaria por sobrevivir entre los mayores del instituto, los abusones, su mejor amigo Rowley y su insufrible hermano mayor Rodrick. Entre estrategias fallidas para hacerse popular y castigos familiares, Greg se convierte en el narrador más sincero y torpe de su generación. Primer título de una serie que ha vendido más de 250 millones de ejemplares en todo el mundo.	6 - 8 AÑOS	1003
9788416290543	Pippi Calzaslargas	Todas las historias	Astrid Lindgren	Blackie Books	Pippi Calzaslargas es una niña pelirroja, increíblemente fuerte y completamente libre que vive sola con un mono y un caballo en Villa Villekula mientras su padre navega por mares lejanos como capitán pirata. Sus aventuras junto a sus amigos Tommy y Annika desafían todas las normas de los adultos y reivindican la rebeldía y la alegría infantil. Esta edición omnibus de Blackie Books reúne por primera vez los tres libros originales de Astrid Lindgren en un solo volumen.	6 - 8 AÑOS	1003
9788434894099	Fray Perico y su borrico		Juan Muñoz Martín	SM	Fray Perico es un fraile bonachón y despistado que llega al convento de San Francisco de Salamanca montado en su inseparable borrico Calcetín, sembrando el caos entre los veinte frailes que vivían en la más absoluta tranquilidad. Sus ocurrencias absurdas y su buen corazón trastocarán para siempre la vida conventual y harán reír a los lectores más jóvenes. Ganador del Premio El Barco de Vapor en 1979, es uno de los libros infantiles españoles más vendidos de todos los tiempos.	6 - 8 AÑOS	1003
9788421634202	Kika Superbruja, detective		Knister	Bruño	Kika Superbruja es una niña aparentemente normal que esconde un libro de magia heredado de una auténtica bruja y que le permite realizar trucos extraordinarios cuando nadie la ve. En esta aventura deberá emplear todos sus hechizos y su astucia para resolver el misterioso robo de la bicicleta de su madre y desenmascarar al ladrón más escurridizo de la ciudad. Primera entrega de una serie de misterio infantil que ha cosechado millones de lectores en toda Europa.	6 - 8 AÑOS	1003
9788408047544	Mi nombre es Stilton, Geronimo Stilton		Geronimo Stilton	Destino	Geronimo Stilton es un ratón algo miedoso y pedante, director del periódico más famoso de Ratonia, La Gaceta del Ratón, cuya vida monótona cambia por completo cuando aparece en su casa la pequeña Tea con ganas de aventuras. Entre persecuciones, misterios y situaciones absurdas, Geronimo descubrirá que una vida tranquila no siempre es la mejor opción. Primer título de la serie italiana creada por Elisabetta Dami, publicado en España por Destino con el formato ilustrado a todo color característico de la colección.	6 - 8 AÑOS	1003
9788498386264	El ladrón del rayo		Rick Riordan	Salamandra	Percy Jackson es un chico de doce años problemático que descubre, tras un extraño incidente con su profesora de matemáticas, que es hijo de un dios del Olimpo. Acusado de robar el rayo de Zeus, Percy emprende junto a sus amigos Grover y Annabeth una aventura a través de Estados Unidos para recuperarlo antes del solsticio de verano y evitar una guerra entre los dioses. Primera entrega de la saga Percy Jackson y los dioses del Olimpo que Rick Riordan inició en 2005.	9 - 12 AÑOS	1004
9788498382372	Coraline		Neil Gaiman	Salamandra	Coraline Jones es una niña curiosa que se acaba de mudar con sus padres a una casa vieja y aburrida en la que descubre una puerta tapiada que conduce a un mundo paralelo inquietante. Allí conoce a su otra madre y a su otro padre, dos figuras con botones por ojos que parecen prestarle más atención que los verdaderos, pero su amor esconde una amenaza terrible. Una novela breve y escalofriante de Neil Gaiman ilustrada por Dave McKean que ganó la medalla Carnegie y el premio Hugo.	9 - 12 AÑOS	1004
9788478442010	Caperucita en Manhattan		Carmen Martín Gaite	Siruela	Sara Allen es una niña de diez años que vive en Brooklyn y sueña con atravesar Manhattan a solas para llevarle una tarta de fresa a su abuela. Su encuentro nocturno con el millonario del pastel, miss Lunatic y un misterioso lobo la llevará a una aventura llena de libertad, imaginación y descubrimiento. Publicada en la colección Las Tres Edades, es una relectura moderna del clásico de Caperucita Roja realizada por la novelista salmantina Carmen Martín Gaite.	9 - 12 AÑOS	1004
9788467561357	Los Futbolísimos 1	El misterio de los árbitros dormidos	Roberto Santiago	SM	Los Futbolísimos son el equipo de fútbol alevín del Soto Alto, un grupo de siete amigos que descubren que todos los árbitros que arbitran sus partidos se quedan dormidos misteriosamente en medio del campo. Si no resuelven el enigma en siete días, su equipo descenderá irremediablemente de categoría. Primera entrega de una de las series infantiles españolas más exitosas de la última década, ilustrada por Enrique Lorenzo.	9 - 12 AÑOS	1004
9788420464466	Konrad o el niño que salió de una lata de conservas		Christine Nöstlinger	Alfaguara	La excéntrica señora Bartolotti recibe por correo una enorme lata de conservas que contiene a un niño de siete años perfectamente educado llamado Konrad. Cuando la empresa que lo fabricó se da cuenta del error e intenta recuperarlo, Bartolotti y Konrad urden un plan para que el niño parezca tan maleducado que nadie lo quiera devolver. Novela humorística de la austriaca Christine Nöstlinger, ganadora del premio Hans Christian Andersen, publicada en Alfaguara.	9 - 12 AÑOS	1004
9788426139160	Cuentos por teléfono		Gianni Rodari	Juventud	El señor Bianchi es un viajante italiano que solo puede llamar a su hija por la noche para contarle un cuento breve antes de dormir, así que cada relato debe caber en los pocos minutos que dura la llamada de larga distancia. El libro recoge setenta de esas historias disparatadas, tiernas y poéticas que el autor italiano convirtió en un clásico de la literatura infantil moderna. Publicado originalmente en 1962, este libro de Gianni Rodari celebra la imaginación liberadora como herramienta educativa.	6 - 8 AÑOS	1003
9788420466781	El pequeño vampiro		Angela Sommer-Bodenburg	Alfaguara	Antón es un niño fascinado por las historias de terror que recibe una noche la visita de Rüdiger, un pequeño vampiro con capa negra y dientes puntiagudos, con quien entabla una insólita amistad. Juntos descubrirán cementerios, volarán sobre los tejados y se enfrentarán a los peligros de los adultos que no creen en vampiros. Primer título de una serie alemana traducida a decenas de idiomas y convertida en clásico del terror infantil juvenil.	6 - 8 AÑOS	1003
9788420482378	El maravilloso Mago de Oz		L. Frank Baum	Alfaguara	Un ciclón arranca la casa de la pequeña Dorothy del estado de Kansas y la deposita en el mágico país de Oz, donde la protagonista emprende un largo viaje por el camino de baldosas amarillas para pedirle al poderoso Mago que la devuelva a casa. Por el camino se le unen un Espantapájaros sin cerebro, un Leñador de Hojalata sin corazón y un León cobarde que también buscan al Mago. Clásico absoluto de la literatura infantil estadounidense publicado originalmente en 1900 y reeditado en la colección Alfaguara Clásicos.	9 - 12 AÑOS	1004
9788415723004	Corazón de Tinta		Cornelia Funke	Siruela	Meggie y su padre Mortimer, un encuadernador apodado Lengua de Brujo, comparten un secreto extraordinario: cuando él lee un libro en voz alta, los personajes pueden escapar de las páginas al mundo real. Cuando el malvado Capricornio, salido hace años del libro Corazón de Tinta, reaparece para vengarse, padre e hija tendrán que emprender una aventura peligrosa para devolverlo a su historia. Primer volumen de la trilogía Mundo de Tinta de la alemana Cornelia Funke, publicada en la colección Las Tres Edades de Siruela.	9 - 12 AÑOS	1004
9788416368471	Mi primer Diccionario Larousse		Larousse Editorial	Larousse	Diccionario infantil ilustrado que presenta dos mil palabras del vocabulario más frecuente de los niños, cada una con su definición sencilla y un ejemplo tomado del mundo de la familia, los amigos y la escuela. Incluye veinte láminas temáticas con ilustraciones realistas de animales, árboles, frutas, verduras, instrumentos musicales y medios de transporte para que los pequeños aprendan mientras juegan. Recomendado a partir de los cinco años, es uno de los títulos más vendidos de Larousse Infantil en el mercado hispanoamericano.	VOCABULARIO	1011
9781474963558	Mi primer libro sobre el cuerpo humano		Varios autores	Usborne	Libro informativo para los más pequeños que explica de forma clara y entretenida cómo funciona el cuerpo humano por dentro, con solapas que se levantan para descubrir los huesos, los músculos, los pulmones o el corazón. Las ilustraciones y los textos sencillos invitan a padres e hijos a compartir un primer acercamiento a la anatomía y la fisiología. Publicado por Usborne dentro de su colección de divulgación infantil ampliamente distribuida en el mercado latinoamericano.	INFORMATIVOS	1008
9788430570065	100 cosas que deberías saber sobre los Dinosaurios		Steve Parker	Susaeta	Libro de divulgación científica para niños que recoge cien datos fascinantes sobre los dinosaurios organizados por temas, desde su clasificación en los distintos periodos geológicos hasta sus hábitos alimenticios, sus defensas y sus sorprendentes récords. Las ilustraciones a todo color y las infografías facilitan el acceso a los contenidos más curiosos de la paleontología. Publicado por Susaeta en la colección 100 Cosas Que Deberías Saber, es uno de los informativos infantiles más populares en el mercado hispanohablante.	INFORMATIVOS	1008
9788416721184	Inventario ilustrado de dinosaurios		Virginie Aladjidi	Faktoría K de Libros	Recorrido científico-ilustrado por cuarenta y siete especies de dinosaurios organizadas en los tres grandes periodos geológicos del Mesozoico: el Triásico, el Jurásico y el Cretácico. Las ilustraciones realistas de Emmanuelle Tchoukriel, inspiradas en los cuadernos de campo naturalistas del siglo XIX, combinan rigor paleontológico con belleza artística. Publicado por Faktoría K de Libros, el sello infantil de Kalandraka, es un referente del álbum informativo en lengua española.	INFORMATIVOS	1008
9788493987749	El Monstruo de Colores		Anna Llenas	Flamboyant	Un monstruo se despierta una mañana con las emociones hechas un lío y no consigue entender por qué se siente contento, triste, rabioso, asustado y en calma al mismo tiempo. Con la ayuda de una niña aprenderá a ordenar sus emociones en frascos de colores, dando a cada sentimiento su propio nombre y su propio tono. Un álbum ilustrado bestseller de Anna Llenas que se ha convertido en una herramienta imprescindible de la educación emocional infantil en el mundo hispanohablante.	EMOCIONES Y VALORES	1006
9788448847906	Topito Terremoto		Anna Llenas	Beascoa	Topito es un pequeño topo que no puede estarse quieto ni un segundo: corre, salta, habla sin parar y lo rompe todo sin querer, y los adultos lo regañan constantemente hasta que empieza a sentirse un desastre. Con la llegada de una nueva maestra descubrirá que su energía desbordante es un don que simplemente necesita un cauce por el que fluir. Un álbum de Anna Llenas sobre la hiperactividad infantil que invita a mirar a los niños con empatía y creatividad.	EMOCIONES Y VALORES	1006
9788467046977	Laberinto del alma		Anna Llenas	Crossbooks	Libro ilustrado para todas las edades que propone un viaje interior a través de cincuenta y ocho emociones y estados del alma, desde la alegría y el amor hasta el miedo, la vergüenza y la nostalgia. Cada página traza el perfil de un sentimiento con ilustraciones simbólicas y textos breves, invitando al lector a resonar con su propio mundo interno. Obra de Anna Llenas publicada por Crossbooks que combina psicoterapia artística y divulgación emocional.	EMOCIONES Y VALORES	1006
9788496388727	Orejas de mariposa		Luisa Aguilar	Kalandraka	Mara es una niña a la que sus compañeros de clase se burlan por el tamaño de sus orejas, pero ella, con ayuda de su madre, aprende a reinterpretar esos rasgos como algo hermoso y único en lugar de un defecto. Cada burla se convierte en una oportunidad para afirmar su autoestima y su identidad con humor y dulzura. Álbum ilustrado por André Neves, finalista del IV Premio Città di Bella, publicado por Kalandraka en la colección Obras de Autor.	EMOCIONES Y VALORES	1006
9788484881100	El punto		Peter H. Reynolds	Serres	Vashti es una niña convencida de que no sabe dibujar y que no puede pintar nada en su hoja en blanco, hasta que frustrada clava su lápiz en el papel y deja un simple punto. Su maestra le pide que firme ese punto y, a partir de ahí, Vashti se embarca en un viaje creativo donde cada nueva mancha y cada nuevo color la llevan a descubrir a la artista que lleva dentro. Álbum ilustrado por Peter H. Reynolds publicado por RBA en la colección Serres, convertido en clásico de la educación creativa.	EMOCIONES Y VALORES	1006
9788415357841	Yo voy conmigo		Raquel Díaz Reguera	Thule	Una niña se enamora de un chico del parque pero él ni siquiera la mira, así que sus amigos le aconsejan que se quite las trenzas, las gafas, las pecas, la sonrisa y las alas que lleva en los hombros para parecer más normal. Cuando por fin el chico se fija en ella, la niña ha perdido todo lo que la hacía única, así que decide recuperar todos y cada uno de sus rasgos. Álbum galardonado publicado por Thule en la colección Trampantojo, escrito e ilustrado por Raquel Díaz Reguera.	EMOCIONES Y VALORES	1006
9788421683125	Las jirafas no pueden bailar		Giles Andreae	Bruño	Chufa es una jirafa larguirucha a la que todos los animales de la selva desprecian en el baile anual porque dicen que, por su cuello larguísimo y sus patas torpes, las jirafas sencillamente no pueden bailar. Hasta que un grillo sabio le muestra que solo necesita su propia música para moverse. Álbum ilustrado por Guy Parker-Rees, publicado por Bruño en versión rimada traducida al español, un clásico contemporáneo del álbum inglés.	EMOCIONES Y VALORES	1006
9789681664435	Mi papá		Anthony Browne	Fondo de Cultura Económica	Un niño describe con orgullo desbordante a su padre, un hombre con bata a cuadros al que considera capaz de saltar sobre la luna, cantar como un cantante de ópera, nadar como un pez y comer como un caballo. A través de imágenes fantásticas e hiperbólicas, Anthony Browne celebra el cariño incondicional que los hijos sienten por sus padres. Parte de la célebre colección Los Especiales de A la Orilla del Viento del Fondo de Cultura Económica.	FAMILIA	1010
9789681673758	Mi mamá		Anthony Browne	Fondo de Cultura Económica	Compañero del álbum Mi papá, este libro cuenta en primera persona todas las cosas fantásticas, extraordinarias e imposibles que un niño ve en su madre: es la mejor cocinera del mundo, la mejor malabarista, la artista más creativa y la persona más valiente que conoce. Anthony Browne dibuja una figura materna universal a través del mismo motivo floral en todas las ilustraciones. Publicado por el Fondo de Cultura Económica en la colección Los Especiales de A la Orilla del Viento.	FAMILIA	1010
9788489804364	Madrechillona		Jutta Bauer	Lóguez	Una mañana la mamá pingüino se pone tan furiosa con su hijo que le grita y su grito es tan fuerte que el pequeño pingüino explota en mil pedazos que salen volando hacia todos los rincones del mundo. La madre, arrepentida, recorre el planeta recomponiendo pacientemente a su hijo hasta devolverlo al nido. Álbum alemán de Jutta Bauer sobre la ira parental y la capacidad de pedir perdón, publicado en España por Lóguez Ediciones.	FAMILIA	1010
9788488342300	Mamá fue pequeña antes de ser mayor		Valérie Larrondo	Kókinos	Según la voz narradora, las mamás siempre fueron niñas perfectas: no se hurgaban la nariz, nunca decían palabrotas, jamás tiraban del rabo al gato ni pintaban las paredes con rotuladores ni sentían celos de sus hermanos pequeños. Pero las ilustraciones contradicen cada una de esas afirmaciones con escenas divertidas que demuestran exactamente lo contrario. Un álbum ingenioso de Valérie Larrondo y Claudine Desmarteau publicado por Kókinos.	FAMILIA	1010
9788495040152	Cuéntame otra vez la noche que nací		Jamie Lee Curtis	Serres	Una niña adoptada le pide a sus padres que le cuenten una y otra vez la historia de cómo llegó a su familia: el viaje en avión, la ropa que llevaba esa noche, el llanto de madrugada y la sensación de haber encontrado por fin su lugar en el mundo. Un álbum tierno ilustrado por Laura Cornell que acompaña a las familias por adopción a poner palabras a los orígenes. Publicado en español por la editorial Serres, traducido por Xavier Borràs.	FAMILIA	1010
9788420482934	Cuentos en verso para niños perversos		Roald Dahl	Alfaguara	Roald Dahl reinterpreta con humor negro y travesuras deliciosas seis cuentos clásicos como Caperucita Roja, Blancanieves, Los tres cerditos, Ricitos de Oro, Juan y las habichuelas mágicas y Cenicienta, contados en un verso ágil y gamberro. En su versión de Dahl, Caperucita dispara con una pistola al lobo y Blancanieves se une a una banda de enanos jugadores. Álbum ilustrado por Quentin Blake y traducido al verso español por Miguel Azaola, publicado en la colección Alfaguara Clásicos.	POESÍA, MÚSICA Y RIMAS	1009
9789871343683	Nanas de la cebolla		Miguel Hernández	Del Naranjo	Edición ilustrada del célebre poema que Miguel Hernández escribió en 1939 en la cárcel, dedicado a su hijo recién nacido Manuel Miguel, tras recibir una carta de su mujer Josefina Manresa explicando que solo tenía pan y cebolla para alimentarlo. El libro preserva uno de los textos poéticos más estremecedores del poeta oriolano y lo acerca a los lectores infantiles con las ilustraciones a color de Matías Acosta. Publicado por Del Naranjo en Argentina, galardonado con el Premio Destacados Alija 2013.	POESÍA, MÚSICA Y RIMAS	1009
9789877385472	El reino del revés		María Elena Walsh	Alfaguara	Antología ilustrada que reúne treinta y ocho de los poemas y canciones más queridos de María Elena Walsh, entre ellos Manuelita la tortuga, La reina Batata, El twist del Mono Liso, La Marcha de Osías y el título que da nombre al volumen. Los versos juguetones y disparatados de la autora argentina han acompañado a varias generaciones de niños hispanohablantes desde 1965. Publicado por Alfaguara Infantil dentro del fondo clásico de literatura infantil rioplatense.	POESÍA, MÚSICA Y RIMAS	1009
9788415208129	El pato y la muerte		Wolf Erlbruch	Barbara Fiore Editora	Un pato comienza a sentir que alguien lo sigue y al volverse descubre que es la muerte en persona, una figura apacible con aire de calavera amable que le confiesa que lleva caminando a su lado toda la vida. Juntos conversan, nadan, contemplan el atardecer y construyen una amistad inesperada hasta que llega el momento final. Álbum delicado y filosófico del ilustrador alemán Wolf Erlbruch publicado en español por Barbara Fiore Editora, considerado uno de los libros más bellos escritos sobre la muerte.	MUERTE, PERDIDAS, SEPARACION Y TEMAS DIFICILES	1016
