ISBN	Title	Subtitle	Author	Editorial	Synopsis	Subject	SubjectCode
9789588886213	Cien años de soledad		Gabriel García Márquez	Debolsillo	La saga de la familia Buendía a lo largo de siete generaciones en el mítico pueblo de Macondo, donde lo mágico y lo cotidiano se entremezclan sin distinción. Es la obra cumbre del realismo mágico latinoamericano y una de las novelas más importantes del siglo XX. Su publicación en 1967 transformó para siempre la literatura en español.	LITERATURA LATINOAMERICANA	1313
9786070757679	El amor en los tiempos del cólera		Gabriel García Márquez	Diana	Fermina Daza y Florentino Ariza protagonizan una historia de amor que se extiende por más de cincuenta años, marcada por el rechazo, la espera y la obstinación. García Márquez explora con maestría los laberintos del amor, los celos y el paso del tiempo en un puerto caribeño del siglo XIX. La novela es una celebración poética del amor tardío y la memoria.	LITERATURA LATINOAMERICANA	1313
9789588886121	El coronel no tiene quien le escriba		Gabriel García Márquez	Debolsillo	Un coronel anciano espera durante quince años la carta que le confirme la pensión militar prometida tras una guerra olvidada, sostenido solo por la terquedad y la dignidad. A su lado, un gallo de pelea se convierte en símbolo de esperanza y resistencia en un pueblo sumido en la violencia y el olvido. La novela es un retrato desnudo de la pobreza, la burocracia y el estoicismo latinoamericano.	LITERATURA LATINOAMERICANA	1313
9789588886176	Crónica de una muerte anunciada		Gabriel García Márquez	Debolsillo	Un narrador reconstruye, años después, las circunstancias que rodearon el asesinato de Santiago Nasar en un pueblo del Caribe colombiano, un crimen que todos sabían que iba a ocurrir pero que nadie pudo o quiso evitar. García Márquez examina la culpa colectiva, el honor, y los mecanismos sociales que convierten la tragedia en inevitable. La novela mezcla el reportaje periodístico con la poesía y el fatalismo del realismo mágico.	LITERATURA LATINOAMERICANA	1313
9788497592413	El otoño del patriarca		Gabriel García Márquez	Debolsillo	El retrato de un dictador caribeño que ha gobernado durante más de cien años, construido a través de un torrente narrativo de frases larguísimas y voces superpuestas que recrean el universo del poder absoluto y la soledad. García Márquez explora la corrupción, el miedo y la decadencia de una tiranía sin nombre ni fecha precisa. Es una de las novelas más ambiciosas y experimentales del autor.	LITERATURA LATINOAMERICANA	1313
9786073151498	Rayuela		Julio Cortázar	Debolsillo	Horacio Oliveira, un intelectual argentino en París, busca desesperadamente el kibbutz del deseo, un absoluto imposible de alcanzar, mientras vive una relación intensa con la Maga. La novela puede leerse de forma lineal o saltando entre capítulos según las instrucciones del autor, lo que la convierte en una obra radicalmente innovadora. Rayuela es el manifiesto literario de la contracultura latinoamericana de los años sesenta.	LITERATURA LATINOAMERICANA	1313
9789589016220	Bestiario		Julio Cortázar	Debolsillo	Ocho cuentos en los que lo fantástico irrumpe de manera natural en la vida cotidiana de personajes comunes, sin que el asombro parezca fuera de lugar. Cortázar establece en este primer libro las reglas de su universo narrativo: la ambigüedad, el juego y la presencia de lo inquietante bajo la superficie de lo real. Bestiario es una obra fundacional del cuento fantástico latinoamericano.	LITERATURA LATINOAMERICANA	1313
9789505111930	Las armas secretas		Julio Cortázar	Alfaguara	Cinco cuentos en los que Cortázar explora el horror, el deseo y la identidad desde perspectivas perturbadoras e inesperadas. El relato que da título al volumen es considerado una de las obras maestras del cuento en lengua española por su compleja estructura y su tensión psicológica. La colección marca la madurez del autor como cuentista y su dominio de lo fantástico.	LITERATURA LATINOAMERICANA	1313
9786124262708	La ciudad y los perros		Mario Vargas Llosa	Debolsillo	En el Colegio Militar Leoncio Prado de Lima, un grupo de cadetes sobrevive a la brutalidad institucional mediante la complicidad, la violencia y la traición. La novela, que causó escándalo en el Perú y fue quemada públicamente, denuncia el militarismo y la corrupción moral de una sociedad jerárquica. Es la primera gran novela de Vargas Llosa y uno de los pilares del boom latinoamericano.	LITERATURA LATINOAMERICANA	1313
9786073133258	La tía Julia y el escribidor		Mario Vargas Llosa	Debolsillo	El joven Marito, aspirante a escritor en la Lima de los años cincuenta, se enamora de su tía política Julia mientras trabaja en una radio donde el extravagante Pedro Camacho escribe interminables radionovelas. La novela alterna la autobiografía del autor con las delirantes tramas de las telenovelas de Camacho, que se mezclan y enredan progresivamente. Es una obra festiva y reflexiva sobre la escritura, el amor y la vocación literaria.	LITERATURA LATINOAMERICANA	1313
9786124262555	Conversación en La Catedral		Mario Vargas Llosa	Debolsillo	En un bar miserable de Lima llamado La Catedral, Santiago Zavala y el chofer Ambrosio reconstruyen durante cuatro horas sus vidas marcadas por la corrupción y la dictadura de Odría en el Perú de los años cincuenta. La novela es una investigación moral y política sobre el fracaso de toda una generación y las complicidades que sostienen el poder. Con su compleja estructura temporal, Vargas Llosa la consideró su obra más lograda.	LITERATURA LATINOAMERICANA	1313
9789588611594	Ficciones		Jorge Luis Borges	Debolsillo	Diecisiete relatos que exploran laberintos, bibliotecas infinitas, enciclopedias de mundos imaginarios y hombres que buscan el infinito en el espejo de la literatura. Borges inventa géneros, parodia la erudición y disuelve las fronteras entre la realidad y la ficción con una precisión matemática y una ironía inagotable. Ficciones es el libro que estableció a Borges como uno de los escritores más influyentes del siglo XX.	LITERATURA LATINOAMERICANA	1313
9789875666481	El Aleph		Jorge Luis Borges	Debolsillo	Una colección de cuentos en los que Borges explora el tiempo circular, los espejos, los dobles y los puntos del universo donde converge todo lo existente. El cuento que da título al volumen narra el descubrimiento de un punto en el sótano de una casa donde se puede ver simultáneamente todo el universo. El Aleph es una de las obras fundamentales de la literatura universal del siglo XX.	LITERATURA LATINOAMERICANA	1313
9788493442606	Pedro Páramo		Juan Rulfo	RM Editorial	Juan Preciado viaja al pueblo de Comala en busca de su padre, Pedro Páramo, y encuentra un lugar habitado únicamente por muertos y murmullos. Rulfo construye una novela fragmentada y poética que mezcla la voz de los vivos y los muertos en una visión del México rural marcado por la violencia, el cacicazgo y el olvido. Pedro Páramo es considerada una obra maestra absoluta de la literatura en español y una precursora del realismo mágico.	LITERATURA LATINOAMERICANA	1313
9788493442613	El llano en llamas		Juan Rulfo	RM Editorial	Diecisiete cuentos que retratan el mundo rural mexicano con una prosa austera y poética, donde los personajes sobreviven entre la violencia de la Revolución, la sequía y la muerte. Rulfo da voz a campesinos, soldados y forajidos atrapados en un paisaje áspero que parece condenado desde siempre. El libro es uno de los grandes clásicos del cuento en lengua española y un retrato implacable de la condición humana.	LITERATURA LATINOAMERICANA	1313
9786073824279	La casa de los espíritus		Isabel Allende	Debolsillo	La saga de la familia Trueba a lo largo de cuatro generaciones en Chile, narrada a través de las voces de mujeres marcadas por el amor, la magia y la lucha política. Allende combina el realismo mágico con la historia reciente de América Latina para construir una épica familiar que culmina en el golpe de Estado. Es la novela que consagró a Isabel Allende como una de las escritoras más importantes de la literatura latinoamericana contemporánea.	LITERATURA LATINOAMERICANA	1313
9786073832021	Eva Luna		Isabel Allende	Debolsillo	Eva Luna es una narradora nata que utiliza las historias como arma de supervivencia en una América Latina convulsa y colorida. A través de su vida errante como huérfana, sirvienta y guerrillera, Allende teje un tapiz de personajes exuberantes que celebran la imaginación y la resistencia. La novela es un homenaje al poder de la palabra y a la capacidad de reinvención de las mujeres latinoamericanas.	LITERATURA LATINOAMERICANA	1313
9786073130288	Como agua para chocolate		Laura Esquivel	Debolsillo	Tita, la menor de tres hermanas en el México de principios del siglo XX, está condenada por tradición familiar a cuidar a su madre y a no casarse, aunque está profundamente enamorada de Pedro. Sus emociones se transfieren mágicamente a los alimentos que prepara, afectando a todos los que los prueban. La novela, estructurada como un recetario, es una celebración de la gastronomía, el deseo y la identidad femenina mexicana.	LITERATURA LATINOAMERICANA	1313
9786070784057	El túnel		Ernesto Sábato	Booket	Juan Pablo Castel, un pintor neurótico y obsesivo, confiesa desde la cárcel el asesinato de María Iribarne, la única mujer que comprendió el sentido oculto de uno de sus cuadros. La novela es una exploración brutal de los celos, la soledad existencial y la incomunicación humana, contada con una lógica aplastante que no admite piedad. El túnel es una de las obras más intensas e inquietantes de la literatura argentina del siglo XX.	LITERATURA LATINOAMERICANA	1313
9789705800085	La muerte de Artemio Cruz		Carlos Fuentes	Alfaguara	Artemio Cruz agoniza y su conciencia oscila entre tres voces narrativas que reconstruyen su vida: la de un revolucionario que traicionó sus ideales para convertirse en un magnate corrupto del México posrevolucionario. Fuentes utiliza una estructura temporal fragmentada para trazar un retrato implacable del poder, la traición y la complicidad que sostienen al sistema político mexicano. La novela es una de las obras más ambiciosas y logradas del boom latinoamericano.	LITERATURA LATINOAMERICANA	1313
9789707490062	Arráncame la vida		Ángeles Mastretta	Booket	Catalina Guzmán narra su vida junto al general Andrés Ascencio, un político corrupto y poderoso del México de los años cuarenta, con quien se casa siendo casi una niña. A través de una voz irónica y sensual, Mastretta retrata la condición de la mujer atrapada entre el amor, el poder y la necesidad de libertad. La novela es un clásico de la narrativa femenina mexicana y un retrato vívido de la época dorada del priismo.	LITERATURA LATINOAMERICANA	1313
9786070306624	El libro de los abrazos		Eduardo Galeano	Siglo XXI Editores	Una colección de viñetas, cuentos brevísimos y reflexiones en las que Galeano celebra la memoria, la solidaridad y la dignidad de los pueblos latinoamericanos con su prosa poética característica. El libro es un recorrido por las experiencias del exilio, la resistencia y la belleza cotidiana que resiste a la injusticia. Es uno de los libros más queridos del autor y un testimonio de su visión humanista y comprometida.	LITERATURA LATINOAMERICANA	1313
9786073838207	El cartero de Neruda		Antonio Skármeta	Debolsillo	En la isla de Isla Negra, el joven cartero Mario Jiménez entabla una amistad con Pablo Neruda y aprende de él el arte de la metáfora para conquistar a la bella Beatriz. Skármeta narra con ternura y humor una historia de amor y poesía ambientada en el Chile previo al golpe de 1973. La novela, llevada al cine como Il Postino, es una de las más encantadoras de la literatura latinoamericana contemporánea.	LITERATURA LATINOAMERICANA	1313
9788437601199	Las armas secretas		Julio Cortázar	Cátedra	Cinco cuentos en los que Cortázar explora el horror, el deseo y la identidad desde perspectivas perturbadoras e inesperadas, con El perseguidor como pieza central. La colección representa la madurez narrativa del autor y su capacidad para transformar lo cotidiano en territorio de lo fantástico. Es uno de los libros de cuentos más influyentes de la literatura latinoamericana del siglo XX.	LITERATURA LATINOAMERICANA	1313
9786073104920	Ficciones		Jorge Luis Borges	Debolsillo	Diecisiete relatos que exploran laberintos, bibliotecas infinitas, enciclopedias de mundos imaginarios y hombres que buscan el infinito en el espejo de la literatura. Borges inventa géneros, parodia la erudición y disuelve las fronteras entre la realidad y la ficción con una precisión matemática y una ironía inagotable. Ficciones es el libro que estableció a Borges como uno de los escritores más influyentes del siglo XX.	LITERATURA LATINOAMERICANA	1313
9788408163435	La sombra del viento		Carlos Ruiz Zafón	Planeta	En el Barcelona de la posguerra, el joven Daniel Sempere descubre un misterioso libro en el Cementerio de los Libros Olvidados que cambiará su vida para siempre. Al intentar protegerlo de un personaje enigmático que acecha desde las sombras, Daniel se adentra en un laberinto de secretos, pasiones y tragedias. Una novela deslumbrante que entrelaza el amor, la pérdida y la memoria en una historia que ha cautivado a millones de lectores en todo el mundo.	LITERATURA Y NOVELA	1301
9788408081180	El juego del ángel		Carlos Ruiz Zafón	Planeta	David Martín, un joven escritor atrapado en el Barcelona oscuro de los años veinte, recibe una misteriosa oferta de un editor que podría cambiar su destino. A medida que se adentra en el encargo, descubrirá que el precio de su alma podría ser más literal de lo que imaginaba. Una novela hipnótica que mezcla el thriller gótico con la reflexión sobre la creación literaria y el poder de las palabras.	LITERATURA Y NOVELA	1301
9788423964482	El alquimista		Paulo Coelho	Planeta	Santiago, un joven pastor andaluz, emprende un viaje en busca de un tesoro escondido junto a las pirámides de Egipto, guiado por señales y sueños que le hablan de su Leyenda Personal. En el camino descubrirá que el verdadero tesoro reside en el propio viaje y en la capacidad de escuchar el lenguaje del mundo. Una fábula filosófica que ha vendido más de 65 millones de ejemplares y se ha convertido en uno de los libros más leídos de todos los tiempos.	LITERATURA Y NOVELA	1301
9786074211214	Tokio blues (Norwegian Wood)		Haruki Murakami	Tusquets	Watanabe recuerda su juventud en el Tokio de los años sesenta, marcada por la pérdida de su mejor amigo y el amor imposible por Naoko, una joven frágil y perturbada. Entre el duelo y el deseo, Watanabe deberá elegir entre el pasado que lo ata y la vida que lo llama. Una novela melancólica y apasionada que convirtió a Murakami en un fenómeno literario mundial.	LITERATURA Y NOVELA	1301
9789584247735	Kafka en la orilla		Haruki Murakami	Tusquets	Kafka Tamura, un adolescente de quince años, huye de su hogar en Tokio y viaja a Takamatsu, donde encontrará refugio en una biblioteca privada y se verá envuelto en una historia que mezcla lo real y lo onírico. Paralelamente, Nakata, un anciano con la capacidad de hablar con los gatos, inicia su propio viaje inexplicable. Una obra magistral que explora los misterios del destino, la identidad y los mundos invisibles que habitan bajo la superficie de lo cotidiano.	LITERATURA Y NOVELA	1301
9789584238597	La insoportable levedad del ser		Milan Kundera	Tusquets	En el Praga de la Primavera checa, Tomás y Teresa viven un amor marcado por la contradicción entre la levedad y el peso de las decisiones existenciales. A través de sus vidas y las de quienes los rodean, Kundera reflexiona sobre el amor, la libertad, la fidelidad y el eterno retorno. Una novela filosófica y apasionante que se ha convertido en un clásico indispensable de la literatura contemporánea.	LITERATURA Y NOVELA	1301
9788432251146	El perfume	Historia de un asesino	Patrick Süskind	Booket	En el París del siglo XVIII nace Jean-Baptiste Grenouille, un ser sin olor propio pero dotado de un olfato sobrenatural que lo convierte en el mayor creador de fragancias de su época. Obsesionado con capturar el aroma perfecto, Grenouille comete crímenes atroces en su búsqueda de la esencia absoluta de la belleza. Una novela extraordinaria y perturbadora sobre la obsesión, el arte y la monstruosidad del genio.	LITERATURA Y NOVELA	1301
9788466347754	La ladrona de libros		Markus Zusak	Debolsillo	En la Alemania de la Segunda Guerra Mundial, Liesel Meminger, una niña de nueve años entregada en adopción, descubre el poder transformador de las palabras y los libros en los momentos más oscuros de la historia. Narrada desde la perspectiva de la Muerte, la novela sigue a Liesel mientras roba libros, aprende a leer y encuentra amor en medio del horror. Una historia profundamente humana sobre la resistencia del espíritu y la fuerza de las palabras frente a la barbarie.	LITERATURA Y NOVELA	1301
9788498389074	El cuento de la criada		Margaret Atwood	Salamandra	En la República de Gilead, una sociedad totalitaria y teocrática que ha reemplazado a los Estados Unidos, las mujeres fértiles son convertidas en Criadas, obligadas a reproducirse para las élites gobernantes. Offred, una de estas Criadas, narra su vida de sometimiento y su resistencia silenciosa en una distopía que resuena con aterradora actualidad. Una obra visionaria que explora los peligros del fanatismo religioso, el control sobre el cuerpo femenino y la resiliencia humana.	LITERATURA Y NOVELA	1301
9788439728122	Americanah		Chimamanda Ngozi Adichie	Literatura Random House	Ifemelu, una joven nigeriana, emigra a Estados Unidos para estudiar y se enfrenta a las complejidades de la raza, la identidad y el amor en una cultura que la obliga a redefinirse constantemente. A través de su blog sobre la experiencia de ser negra en América y su reencuentro con su primer amor, Obinze, la novela traza un retrato íntimo y político de la diáspora africana. Una obra brillante y urgente que examina el racismo, la clase social y el anhelo de pertenencia con una voz extraordinariamente fresca.	LITERATURA Y NOVELA	1301
9788499890944	1984		George Orwell	Debolsillo	En la oscura sociedad del Estado totalitario de Oceanía, Winston Smith trabaja reescribiendo la historia para el Partido que controla cada aspecto de la vida humana bajo la omnipresente mirada del Gran Hermano. Su pequeño acto de rebelión, un diario secreto y un amor prohibido, lo pondrá en ruta de colisión con el implacable aparato del poder. La distopía más influyente del siglo XX, que acuñó términos como «Gran Hermano», «doblepensar» y «neolengua» que definen nuestra comprensión del totalitarismo.	LITERATURA Y NOVELA	1301
9789584287120	Fahrenheit 451		Ray Bradbury	Minotauro	En un futuro en que los bomberos no apagan incendios sino que los provocan para quemar libros prohibidos, Guy Montag comienza a cuestionar el orden establecido cuando conoce a una joven que le muestra el valor del pensamiento y la memoria. Su despertar lo llevará a enfrentarse a una sociedad que prefiere la ignorancia al conocimiento y el entretenimiento vacío a la reflexión. Una obra profética y apasionante sobre la censura, la libertad intelectual y el poder redentor de la literatura.	LITERATURA Y NOVELA	1301
9788420412146	Don Quijote de la Mancha		Miguel de Cervantes Saavedra	Alfaguara	El hidalgo Alonso Quijano, enloquecido por la lectura de libros de caballerías, se convierte en el Caballero Don Quijote de la Mancha y emprende junto a su fiel escudero Sancho Panza una serie de aventuras disparatadas en la España del siglo XVII. La novela fundacional de la literatura moderna occidental explora con humor y profundidad los límites entre la locura y la cordura, la realidad y la ilusión. Editada por la Real Academia Española y Alfaguara, esta edición conmemoró el cuarto centenario de la primera publicación de la obra.	CLASICOS	1304
9788478887194	El principito		Antoine de Saint-Exupéry	Salamandra	Un aviador que ha aterrizado de emergencia en el desierto del Sahara conoce a un pequeño príncipe venido de otro planeta que le relata sus viajes por el universo y las lecciones que ha aprendido sobre la amistad, el amor y la esencia de las cosas. A través de sus encuentros con personajes peculiares y su amor por una rosa, el Principito revela verdades fundamentales sobre la vida que solo los niños comprenden plenamente. La obra más traducida de la literatura francesa es una fábula poética y filosófica que ha encantado a lectores de todas las edades desde su publicación en 1943.	CLASICOS	1304
9788420651361	La metamorfosis		Franz Kafka	Alianza Editorial	Gregor Samsa despierta una mañana transformado en un monstruoso insecto y debe enfrentarse a la reacción de su familia, que oscila entre el horror, la compasión y el rechazo. A través de esta perturbadora alegoría, Kafka explora temas como la alienación, la identidad, el trabajo deshumanizante y los vínculos familiares. Una de las obras más influyentes de la literatura universal del siglo XX, La metamorfosis es una obra breve que encierra una potencia simbólica inagotable.	CLASICOS	1304
9788420669786	El extranjero		Albert Camus	Alianza Editorial	Meursault, un joven argelino indiferente ante la muerte de su madre, comete un crimen aparentemente sin motivo bajo el sol abrasador de Argel y debe enfrentarse a un juicio en el que se juzga menos el acto que su falta de emoción. La novela fundacional del existencialismo absurdista de Camus presenta a un antihéroe que encarna la indiferencia del universo ante la condición humana. Una obra extraordinariamente concisa y poderosa que sigue siendo uno de los textos filosóficos y literarios más leídos del siglo XX.	CLASICOS	1304
9788420665658	Crimen y castigo		Fiódor Dostoievski	Alianza Editorial	El estudiante Rodión Raskólnikov, convencido de pertenecer a la categoría de los hombres superiores, asesina a una anciana usurera creyendo que el fin justifica los medios, pero la culpa lo corroe desde el primer instante. A través de su enfrentamiento psicológico con el sagaz inspector Porfiry y su relación con la abnegada Sonia, Dostoievski explora los abismos de la conciencia humana. Una de las novelas más grandes de la historia, Crimen y castigo es un estudio insuperable sobre la culpa, la redención y la complejidad moral del ser humano.	CLASICOS	1304
9788484288442	Ana Karenina		León Tolstói	Alba Editorial	Ana Karenina, una aristócrata casada de la sociedad rusa del siglo XIX, abandona su vida convencional por un amor apasionado con el conde Vronski, desafiando las normas sociales que la condenarán al ostracismo. Paralelamente, la historia de Lievin, un terrateniente que busca el sentido de la existencia a través del trabajo y el amor, ofrece un contrapunto filosófico a la tragedia de Ana. Considerada por muchos la novela perfecta, Ana Karenina es una obra monumental sobre el amor, la sociedad, la moral y la búsqueda de la felicidad.	CLASICOS	1304
9788484284888	Orgullo y prejuicio		Jane Austen	Alba Editorial	La vivaz Elizabeth Bennet y el orgulloso señor Darcy se enfrentan por primera vez en un baile y su mutua antipatía da paso, a lo largo de una serie de malentendidos y revelaciones, a uno de los romances más celebrados de la literatura en lengua inglesa. A través de las cinco hermanas Bennet y su madre empeñada en casarlas bien, Austen traza una sátira brillante de las costumbres y valores de la Inglaterra rural de su época. Una novela que ha resistido el paso del tiempo con su inteligencia, humor e irresistible encanto.	CLASICOS	1304
9788420675626	El gran Gatsby		F. Scott Fitzgerald	Alianza Editorial	En los dorados años veinte, el misterioso y opulento Jay Gatsby organiza fiestas legendarias en su mansión de Long Island con la esperanza de reencontrarse con Daisy Buchanan, el amor perdido de su juventud. Narrada por Nick Carraway, primo de Daisy, la novela desmonta el mito del Sueño Americano mostrando la corrupción y el vacío que se esconden bajo la superficie brillante de la prosperidad. Una obra maestra de precisión estilística que captura el espíritu de una época y ofrece una visión perdurable sobre la ilusión, la ambición y el paso del tiempo.	CLASICOS	1304
9788420651408	Romeo y Julieta		William Shakespeare	Alianza Editorial	En la ciudad italiana de Verona, Romeo Montesco y Julieta Capuleto se enamoran apasionadamente a pesar de pertenecer a dos familias enemigas cuya rivalidad ha ensangrentado la ciudad durante generaciones. Su amor secreto y su matrimonio precipitado desencadenan una serie de tragedias que culminarán en la muerte de ambos jóvenes. La más célebre tragedia romántica de todos los tiempos es una exploración imperecedera del amor absoluto, el destino, el odio heredado y la fugacidad de la dicha.	CLASICOS	1304
9788423345410	Los hombres que no amaban a las mujeres		Stieg Larsson	Destino	Mikael Blomkvist, un periodista de investigación, es contratado por un poderoso industrial para resolver el misterio de la desaparición de su sobrina hace cuarenta años. En el transcurso de la investigación, la enigmática hacker Lisbeth Salander se convierte en su aliada imprescindible. Juntos descubrirán secretos oscuros y crímenes enterrados en el pasado de una influyente familia sueca.	THRILLER O NOVELA NEGRA	1303
