ISBN	Title	Subtitle	Author	Editorial	Synopsis	Subject	SubjectCode
9788423349821	La chica que soñaba con una cerilla y un bidón de gasolina		Stieg Larsson	Destino	Lisbeth Salander, recuperada de sus heridas, trata de reconstruir su vida mientras Mikael Blomkvist investiga una red de tráfico de personas vinculada a los servicios de inteligencia suecos. Cuando Lisbeth es acusada de un triple asesinato, Blomkvist deberá demostrar su inocencia antes de que sea demasiado tarde. La trama revela oscuros secretos del pasado de Salander y la corrupción institucional.	THRILLER O NOVELA NEGRA	1303
9788423349579	La reina en el palacio de las corrientes de aire		Stieg Larsson	Ediciones Destino	En la conclusión de la trilogía Millennium, Lisbeth Salander se enfrenta a un juicio por intento de asesinato mientras Mikael Blomkvist lucha para sacar a la luz una conspiración estatal de décadas. Las revelaciones sobre el pasado de Lisbeth y las estructuras de poder que la han perseguido toda su vida llegan a un clímax explosivo. La novela cierra con maestría los hilos narrativos de la saga.	THRILLER O NOVELA NEGRA	1303
9788408141471	La chica del tren		Paula Hawkins	Planeta	Rachel toma el mismo tren todos los días y observa desde la ventana la vida aparentemente perfecta de una pareja en una casa cercana a la vía. Cuando la mujer desaparece, Rachel se ve involucrada en la investigación, aunque su memoria fragmentada por el alcohol la convierte en una testigo poco fiable. Un thriller psicológico que juega con la percepción y los secretos que todos escondemos.	THRILLER O NOVELA NEGRA	1303
9788490624951	Perdida		Gillian Flynn	Debolsillo	El día del quinto aniversario de matrimonio de Nick y Amy Dunne, Amy desaparece sin dejar rastro. Mientras la policía investiga y los medios especulan, los diarios de Amy revelan una imagen cada vez más inquietante de su relación. Un thriller perturbador sobre el matrimonio, los secretos y la manipulación psicológica que mantuvo al mundo en vilo.	THRILLER O NOVELA NEGRA	1303
9788408176022	El código Da Vinci		Dan Brown	Planeta	El profesor Robert Langdon es convocado al Louvre tras el asesinato del conservador del museo, cuyo cuerpo ha sido hallado en una extraña posición junto a crípticos mensajes. Junto a la criptóloga Sophie Neveu, Langdon descubre que el crimen está vinculado a una sociedad secreta que protege un antiguo misterio relacionado con el Santo Grial. Una carrera contrarreloj a través de símbolos, arte y conspiraciones sacude los cimientos de la historia occidental.	THRILLER O NOVELA NEGRA	1303
9788408176008	Ángeles y demonios		Dan Brown	Planeta	El simbologista Robert Langdon es llamado urgentemente a un laboratorio suizo tras el asesinato de un científico y el robo de una cantidad devastadora de antimateria. La pista lo lleva al Vaticano, donde una antigua hermandad conocida como los Illuminati amenaza con destruir la Ciudad del Vaticano durante la elección del nuevo Papa. Una trepidante novela que entrelaza ciencia, religión y arte en una cuenta atrás explosiva.	THRILLER O NOVELA NEGRA	1303
9788490628348	El club Dumas		Arturo Pérez-Reverte	Debolsillo	Lucas Corso, un experto en libros antiguos y mercenario de la bibliofilia, es contratado para autenticar un fragmento del manuscrito original de Los tres mosqueteros de Dumas. Paralela y misteriosamente, investiga un libro de magia del siglo XVII cuyos anteriores propietarios mueren en extrañas circunstancias. Una apasionante novela que mezcla la erudición literaria con el suspense y el homenaje a la cultura popular.	THRILLER O NOVELA NEGRA	1303
9788445009598	El señor de los anillos: La comunidad del anillo		J.R.R. Tolkien	Minotauro	El joven hobbit Frodo Bolsón hereda un anillo mágico de su tío Bilbo, sin saber que es el Único Anillo, creado por el Señor Oscuro Sauron para dominar la Tierra Media. Acompañado por un grupo de compañeros de diversas razas, emprende un peligroso viaje para destruirlo en las llamas del Monte del Destino. El primer volumen de la épica trilogía que redefinió la fantasía moderna.	FANTASIA Y CIENCIA FICCION	1308
9788445012802	El Hobbit		J.R.R. Tolkien	Minotauro	El tranquilo hobbit Bilbo Bolsón es arrastrado inesperadamente en una aventura por el mago Gandalf y una compañía de enanos con el objetivo de recuperar el tesoro custodiado por el dragón Smaug. Durante el viaje, Bilbo encuentra un anillo mágico y descubre reservas de valentía que jamás imaginó poseer. Una novela de aventuras llena de humor y maravilla que sirve como preludio a El señor de los anillos.	FANTASIA Y CIENCIA FICCION	1308
9788498382662	Harry Potter y la piedra filosofal		J.K. Rowling	Salamandra	El huérfano Harry Potter descubre el día de su undécimo cumpleaños que es un mago y que está admitido en el colegio Hogwarts de Magia y Hechicería. Allí hace sus primeros amigos, aprende a volar en escoba y se enfrenta a un misterio que involucra la legendaria piedra filosofal y al oscuro Lord Voldemort. El inicio de una saga que conquistó a lectores de todas las edades alrededor del mundo.	FANTASIA Y CIENCIA FICCION	1308
9788478884957	Harry Potter y la cámara secreta		J.K. Rowling	Salamandra	En su segundo año en Hogwarts, Harry Potter debe enfrentarse a una serie de ataques misteriosos que petrifican a los alumnos y que parecen provenir de una temida cámara secreta dentro del castillo. Con la ayuda de Ron y Hermione, Harry descubre la verdad sobre un oscuro pasado del colegio y el heredero de Slytherin. La aventura profundiza en los poderes ocultos de Harry y la amenaza latente de Voldemort.	FANTASIA Y CIENCIA FICCION	1308
9788478887613	Harry Potter y el prisionero de Azkaban		J.K. Rowling	Salamandra	En su tercer año, Harry descubre que el peligroso fugitivo Sirius Black, supuesto seguidor de Voldemort, ha escapado de la prisión de Azkaban y parece tener como objetivo matarle. La llegada al colegio de los terroríficos dementores y del nuevo profesor de Defensa, Remus Lupin, complica aún más un año lleno de secretos y revelaciones. Una entrega que amplía el universo mágico y presenta giros narrativos inesperados.	FANTASIA Y CIENCIA FICCION	1308
9788466363402	Dune		Frank Herbert	Debolsillo	En un lejano futuro, el joven Paul Atreides llega al árido planeta Arrakis, única fuente de la especia más valiosa del universo, tras recibir su gobierno como una trampa tendida por sus enemigos. Inmerso en la cultura del pueblo Fremen y en las profecías que lo señalan como mesías, Paul forja su destino entre la arena y la política intergaláctica. Considerada la novela de ciencia ficción más influyente de todos los tiempos.	FANTASIA Y CIENCIA FICCION	1308
9788466350945	Un mundo feliz		Aldous Huxley	Debolsillo	En un Estado Mundial del futuro, la humanidad ha alcanzado la estabilidad a costa de la libertad, el arte y la familia, condicionando a los individuos desde el nacimiento para amar su destino predeterminado. Bernard Marx y el Salvaje John cuestionan ese orden perfecto, enfrentándose a las consecuencias de la disidencia. Una novela distópica fundamental que sigue siendo perturbadoramente vigente.	FANTASIA Y CIENCIA FICCION	1308
9788408210047	Las crónicas de Narnia: El león, la bruja y el armario		C.S. Lewis	Destino	Los hermanos Pevensie descubren por accidente el mundo mágico de Narnia a través de un armario, un reino helado bajo el eterno invierno impuesto por la Bruja Blanca. Allí se unen al majestuoso león Aslan para liberar Narnia y cumplir una antigua profecía que los convierte en reyes y reinas. Una alegoría épica de la lucha entre el bien y el mal que ha encantado a generaciones de lectores.	FANTASIA Y CIENCIA FICCION	1308
9788496208926	Juego de tronos		George R.R. Martin	Gigamesh	En los Siete Reinos de Poniente, las grandes familias nobiliarias se disputan el Trono de Hierro en un juego de alianzas, traiciones y guerra, mientras en el norte una amenaza sobrenatural acecha más allá del inmenso muro de hielo. Eddard Stark, nombrado Mano del Rey, descubre una conspiración que pondrá en peligro a todos los que ama. El inicio de una saga épica que redefinió la fantasía de alto voltaje político.	FANTASIA Y CIENCIA FICCION	1308
9788401328510	Los pilares de la tierra		Ken Follett	Plaza & Janés	En la Inglaterra del siglo XII, un monje, un constructor y una noble luchan por edificar la catedral más hermosa del mundo en el ficticio pueblo de Kingsbridge, mientras guerras civiles, intrigas eclesiásticas y rivalidades personales amenazan con destruirlo todo. Ken Follett teje magistralmente vidas humanas con la grandiosidad de la arquitectura gótica y la brutalidad de la época medieval. Una novela monumental que es a la vez historia, aventura y amor.	NOVELA HISTORICA	1307
9788401019609	Un mundo sin fin		Ken Follett	Plaza & Janés	Doscientos años después de los sucesos de Los pilares de la tierra, nuevos habitantes de Kingsbridge afrontan la devastación de la Peste Negra, las rivalidades gremiales y las guerras que sacuden la Inglaterra del siglo XIV. Merthin, un joven constructor de talento, y Caris, una mujer de ideas revolucionarias, lucharán por sus sueños en un mundo en transformación. Una épica continuación que recupera toda la grandeza de la primera novela.	NOVELA HISTORICA	1307
9788496546301	El médico		Noah Gordon	Ediciones B	En la Inglaterra del siglo XI, Rob Cole, un joven huérfano con un don extraordinario para percibir la muerte inminente, recorre medio mundo disfrazado de judío para estudiar medicina en Ispahán con el gran maestro Ibn Sina. La novela es un viaje apasionante por culturas, religiones y el despertar de la ciencia occidental. Una historia de superación, tolerancia y el eterno anhelo humano de sanar.	NOVELA HISTORICA	1307
9788484504900	Memorias de Adriano		Marguerite Yourcenar	Debolsillo	En forma de carta a su sucesor Marco Aurelio, el emperador Adriano repasa al final de su vida sus campañas militares, sus amores, su visión del poder y su profunda melancolía ante la decadencia que presiente. Yourcenar reconstruye con rigor y lirismo el mundo del Imperio Romano del siglo II, dando voz a uno de sus gobernantes más refinados e intelectuales. Una de las grandes novelas históricas del siglo XX.	NOVELA HISTORICA	1307
9788497592581	El nombre de la rosa		Umberto Eco	Debolsillo	El monje franciscano Guillermo de Baskerville llega a una abadía italiana del siglo XIV para investigar una serie de muertes misteriosas que se suceden entre sus muros. Junto a su novicio Adso de Melk, descifra laberintos de piedra y pergamino para encontrar la verdad oculta en una biblioteca prohibida. Una novela que es a la vez relato policial, reflexión filosófica y fascinante recreación del Medioevo.	NOVELA HISTORICA	1307
9788416259595	Veinte poemas de amor y una canción desesperada		Pablo Neruda	Debolsillo	Publicado en 1924 cuando Neruda tenía apenas veinte años, este poemario es una de las obras más leídas en lengua española, en la que el poeta canta con intensidad desbordante al amor, al deseo y a la pérdida. Sus versos combinan imágenes del paisaje chileno con la pasión erótica y la melancolía de lo que termina. Un libro iniciático que ha enamorado a generaciones de lectores en todo el mundo.	POESÍA	1312
9788497598156	Canto general		Pablo Neruda	Debolsillo	Obra monumental publicada en 1950, Canto general es un poema épico que recorre la historia, la naturaleza y los pueblos de América Latina desde sus orígenes precolombinos hasta el presente del poeta. Neruda celebra héroes anónimos, denuncia la opresión y reivindica la dignidad de los pueblos latinoamericanos con una voz poderosa y solidaria. Es considerada una de las cimas de la poesía en español del siglo XX.	POESÍA	1312
9788437607252	Poeta en Nueva York		Federico García Lorca	Cátedra	Escrito durante la estancia de Lorca en la Universidad de Columbia entre 1929 y 1930, este poemario refleja su choque con la modernidad deshumanizada de la gran metrópolis, la soledad, el racismo y la injusticia social. Con imágenes surrealistas de gran intensidad, el poeta expresa angustia existencial y una profunda compasión por los marginados. Una obra que rompió con sus trabajos anteriores y anticipa la poesía contemporánea.	POESÍA	1312
9788420646657	Antología poética		Antonio Machado	Alianza	Esta antología recoge los poemas más representativos de Antonio Machado, desde los versos íntimos y melancólicos de Soledades hasta los paisajes castellanos de Campos de Castilla y los aforismos filosóficos de sus Proverbios y cantares. La selección ofrece un recorrido por la evolución poética de uno de los grandes maestros de la generación del 98 español. Una lectura imprescindible para acercarse a la lírica española moderna.	POESÍA	1312
9788490322161	Cincuenta sombras de Grey		E.L. James	Debolsillo	La joven estudiante Anastasia Steele conoce al misterioso y poderoso empresario Christian Grey cuando lo entrevista para el periódico universitario, iniciando una relación que la arrastra a un mundo de emociones y contratos insospechados. La novela explora una apasionada historia de amor marcada por las heridas emocionales de Grey y los límites que ambos deben negociar. Fenómeno editorial mundial que conquistó a millones de lectores con su mezcla de romance y erotismo.	NOVELA ROMANTICA Y NEW ADULT	1305
9788499184401	Diario de una pasión		Nicholas Sparks	RBA	Noah Calhoun regresa a su pueblo natal en Carolina del Norte tras la Segunda Guerra Mundial con la esperanza de reencontrarse con Allie, el amor de su juventud, del que fue separado por la diferencia de clases. Décadas después, un anciano lee cada día un cuaderno a una mujer con pérdida de memoria para devolverle, aunque sea brevemente, el recuerdo de su historia de amor. Una novela romántica que celebra la fidelidad, la memoria y el amor que trasciende el tiempo.	NOVELA ROMANTICA Y NEW ADULT	1305
9788498724356	El psicoanalista		John Katzenbach	B de Bolsillo	El doctor Frederick Starks, un respetado psicoanalista de Nueva York, recibe el día de su cincuenta y tres cumpleaños un anónimo amenazante que le otorga quince días para averiguar la identidad del autor, bajo la amenaza de presenciar el asesinato sistemático de sus seres queridos. Sin confiar en la policía y guiado por las pistas retorcidas que su verdugo le va dejando, Starks emprende una desesperada investigación que lo obliga a escarbar en su propio pasado profesional. John Katzenbach construye un thriller psicológico implacable que se convirtió en uno de los mayores éxitos de la narrativa de suspense en lengua española.	THRILLER O NOVELA NEGRA	1303
9788488342331	La pequeña oruga glotona		Eric Carle	Kókinos	Una pequeña oruga sale del huevo un lunes con muchísima hambre y cada día de la semana devora más y más alimentos hasta sentirse pesada y atiborrada. Después de atravesar una hoja verde se envuelve en un capullo durante dos semanas y emerge transformada en una hermosa mariposa. Clásico absoluto del álbum infantil en formato cartoné, ideal para los más pequeños gracias a sus páginas agujereadas y sus colores llenos de vida.	0 - 2 AÑOS	1001
9788416126071	Adivina cuánto te quiero		Sam McBratney	Kókinos	La pequeña Liebre Color Avellana quiere explicarle a la Gran Liebre Color Avellana cuánto la quiere y ambas se embarcan en un juego tierno y conmovedor para medir la dimensión de su cariño. Con cada gesto que intenta abarcar su amor, la liebre adulta responde superándola con un cariño todavía mayor. Un álbum clásico sobre el vínculo entre padres e hijos, editado en tapa cartoné para los más pequeños con ilustraciones de Anita Jeram.	0 - 2 AÑOS	1001
9788420430225	Donde viven los monstruos		Maurice Sendak	Alfaguara Infantil	Max, un niño castigado sin cenar por portarse como un pequeño salvaje, navega con su imaginación hasta una isla poblada por monstruos a los que termina dominando y coronándose como su rey. Tras una noche de juegos feroces decide regresar a casa, donde lo espera la cena aún caliente. Obra maestra del álbum ilustrado contemporáneo y ganadora de la Medalla Caldecott en 1964.	3 - 5 AÑOS	1002
9788448823283	Elmer		David McKee	Beascoa	Elmer es un elefante de colores a cuadros que vive en una manada de elefantes grises y, cansado de sentirse distinto, decide teñirse del color de los demás. Al darse cuenta de que sin su alegría los otros elefantes pierden toda su gracia, Elmer aprende a celebrar su diferencia y sus compañeros instauran un día especial en su honor. Uno de los álbumes más queridos del mundo para enseñar a los niños el valor de la diversidad.	3 - 5 AÑOS	1002
9788484645641	¿A qué sabe la luna?		Michael Grejniec	Kalandraka	Los animales del bosque siempre se han preguntado a qué sabe la luna y un día deciden subirse unos sobre otros formando una torre para intentar alcanzarla y probar un pedacito. Cuando la pequeña ratoncita logra por fin morder su trozo, descubre una respuesta que sorprende a todos sus compañeros. Una fábula clásica sobre el trabajo en equipo y los sueños compartidos, publicada en la colección Libros para Soñar de Kalandraka.	3 - 5 AÑOS	1002
9788469605356	El grúfalo		Julia Donaldson	Bruño	Un pequeño ratón pasea por el bosque y, para espantar a los depredadores que quieren comérselo, inventa a un terrible monstruo llamado Grúfalo con enormes colmillos y garras afiladas. Cuando finalmente se encuentra cara a cara con un Grúfalo real, deberá usar su ingenio para salir ileso de la aventura. Un cuento en rima ilustrado por Axel Scheffler que se ha convertido en un clásico contemporáneo de la literatura infantil.	3 - 5 AÑOS	1002
9788492750368	Un libro		Hervé Tullet	Kókinos	Al abrir este álbum aparece un único punto amarillo en la página en blanco que el lector está invitado a presionar con el dedo para descubrir qué ocurre a continuación. A medida que se frotan, soplan, sacuden y golpean los puntos de colores, estos se multiplican, cambian de lugar y responden como por arte de magia a las acciones del niño. Una obra interactiva revolucionaria que demuestra que no hacen falta pantallas para jugar con las páginas de un libro.	LIBROS INTERACTIVOS	1013
9789802571079	Vamos a cazar un oso		Michael Rosen	Ediciones Ekaré	Una familia valiente sale de casa decidida a cazar un enorme oso y atraviesa a su paso campos de hierba alta, ríos helados, bosques oscuros, tormentas de nieve y cuevas misteriosas. Cuando por fin encuentran al verdadero oso, la expedición se convierte en una carrera frenética de regreso al hogar. Un clásico del álbum infantil con estructura acumulativa y rítmica, ilustrado por Helen Oxenbury e ideal para leer en voz alta.	3 - 5 AÑOS	1002
9789802572656	Buenas noches, gorila		Peggy Rathmann	Ediciones Ekaré	Cae la noche en el zoológico y el guardián hace su ronda para despedirse animal por animal sin darse cuenta de que un pequeño gorila travieso le ha robado las llaves y va liberando a todos sus compañeros a sus espaldas. Cuando el guardián llega por fin a su casa, descubre una sorpresa hilarante esperándolo en su dormitorio. Un álbum casi sin palabras que se ha convertido en un referente de la literatura infantil para los más pequeños.	3 - 5 AÑOS	1002
9788448821913	El pez Arcoíris		Marcus Pfister	Beascoa	El pez Arcoíris es el más hermoso del océano gracias a sus brillantes escamas multicolor, pero su vanidad lo mantiene solo y sin amigos entre los peces del arrecife. Solo cuando aprende a compartir sus escamas plateadas con los demás descubre que la verdadera felicidad se encuentra en la generosidad. Un clásico ilustrado con escamas holográficas que ha conquistado a niños de más de sesenta países.	3 - 5 AÑOS	1002
9788416126958	¡Oh! Un libro con sonidos		Hervé Tullet	Kókinos	Este álbum interactivo invita al lector a presionar, arrastrar y tocar puntos de colores que emiten diferentes sonidos imaginarios según la acción que realiza el niño. Las páginas cantan, rugen, susurran y ríen gracias únicamente a la participación activa del pequeño lector. Forma parte junto con Un libro y Colores de la trilogía interactiva más celebrada de Hervé Tullet.	LIBROS INTERACTIVOS	1013
9788493375911	Frederick		Leo Lionni	Kalandraka	Mientras sus compañeros ratones trabajan incansablemente recolectando comida para el largo invierno, Frederick parece no hacer nada y les explica que está reuniendo rayos de sol, colores y palabras para cuando más los necesiten. Cuando las provisiones se acaban y el frío se hace insoportable, los dones poéticos de Frederick resultan ser el más valioso de todos los alimentos. Una fábula clásica sobre la importancia del arte y la imaginación, publicada originalmente en 1967.	3 - 5 AÑOS	1002
9788494176562	Colores		Hervé Tullet	Kókinos	Un punto gris da la señal de salida a un juego lleno de colores que responden al tacto, a la presión y al movimiento del lector. Con cada gesto el niño descubre cómo se mezclan el rojo y el azul, cómo nacen nuevos tonos y cómo las páginas se transforman en una paleta viva. Segundo título de la trilogía interactiva de Hervé Tullet, continuación natural de Un libro.	LIBROS INTERACTIVOS	1013
9788466649902	¿Dónde está Wally?		Martin Handford	Ediciones B	Wally es un peculiar viajero con gafas y jersey a rayas rojas y blancas que se esconde en cada ilustración entre multitudes abarrotadas de personajes disparatados por encontrar. En esta edición conmemorativa los lectores recorren playas, estaciones de tren, aeropuertos y museos en busca del protagonista y de sus curiosos objetos perdidos. Un clásico de la literatura infantil de búsqueda visual que lleva décadas entreteniendo a niños y adultos por igual.	LIBROS DE ACTIVIDADES	1014
9788488342980	Alicia en el país de las maravillas		Robert Sabuda	Kókinos	Adaptación desplegable del clásico cuento de Lewis Carroll en la que Robert Sabuda recrea con minuciosos escenarios tridimensionales la caída de Alicia por la madriguera, el té del Sombrerero Loco y el juicio de la Reina de Corazones. Cada página despliega castillos, naipes y criaturas en movimiento que parecen cobrar vida al pasar las hojas. Una obra maestra de la ingeniería de papel para todas las edades.	LIBROS POP UP	1012
9788420467290	El topo que quería saber quién se había hecho aquello en su cabeza		Werner Holzwarth	Alfaguara	Un topo sale de su madriguera y descubre con horror que algo desagradable ha aterrizado justo encima de su cabeza, así que decide investigar al culpable preguntando a cada animal de la granja. Cada encuentro se convierte en una lección sorprendente sobre las distintas maneras en que los animales hacen sus necesidades. Un clásico contemporáneo del álbum infantil ilustrado por Wolf Erlbruch que combina humor escatológico con personajes inolvidables.	3 - 5 AÑOS	1002
9789681663469	Olivia		Ian Falconer	Fondo de Cultura Económica	Olivia es una cerdita imaginativa, vivaz y un poco presumida que llena cada día con un torbellino de actividades que agotan a toda su familia: canta, baila, se disfraza, visita museos y sueña con ser bailarina. Sus ilustraciones en blanco, negro y rojo la han convertido en uno de los personajes más reconocibles del álbum infantil contemporáneo. Ganadora del Caldecott Honor, es la primera aventura de una serie mundialmente querida.	3 - 5 AÑOS	1002
9788469600474	Querido zoo		Rod Campbell	Bruño	Un niño escribe al zoológico pidiendo una mascota y, con cada página, recibe un animal diferente escondido detrás de una solapa que el lector debe levantar para descubrirlo. Ninguno acaba de convencerle hasta que finalmente llega el animal perfecto. Un clásico con solapas publicado originalmente en 1982, ideal para enseñar animales y adjetivos básicos a los más pequeños.	0 - 2 AÑOS	1001
9789681636531	Willy el tímido		Anthony Browne	Fondo de Cultura Económica	Willy es un chimpancé amable y tímido al que unos gorilas abusadores llaman debilucho y, cansado de sentirse así, decide transformarse siguiendo un programa de ejercicio, boxeo y dieta especial anunciado en una revista. Cuando por fin se siente fuerte, un tropiezo inesperado le demuestra que su verdadero valor no está en los músculos. Uno de los álbumes más queridos del ilustrador británico Anthony Browne, publicado en la colección Los Especiales de A la Orilla del Viento.	3 - 5 AÑOS	1002
9788492412198	El libro negro de los colores		Menena Cottin	Libros del Zorro Rojo	Tomás es un niño ciego y en este álbum explica a los lectores videntes cómo experimenta él los colores a través del olfato, el gusto, el tacto y la emoción. Las ilustraciones en relieve sobre fondo negro invitan a leer con los dedos, de la misma manera en que Tomás percibe el mundo. Obra ilustrada por Rosana Faría, merecedora del Primer Premio Nuevos Horizontes en la Feria del Libro Infantil de Bolonia 2007 y traducida a dieciséis idiomas.	3 - 5 AÑOS	1002
9789580493921	Choco encuentra una mamá		Keiko Kasza	Norma	Choco es un pequeño pájaro amarillo que busca desesperadamente una mamá y pregunta a distintos animales si alguna de ellas podría ser su madre, aunque ninguna se parece a él. Cuando pierde toda esperanza aparece la señora Oso, que a pesar de ser tan diferente le ofrece exactamente el cariño que necesita. Un álbum tierno sobre la adopción y el significado verdadero del concepto de familia, clásico de la colección Buenas Noches de Norma.	3 - 5 AÑOS	1002
